{
    "spec": "owlume.fallacies.v2",
    "version": "2.0.0",
    "updated_at": "2025-11-01",
    "notes": "Clusters ~100 variants under ~20 roots. Keep roots aligned to Matrix Principles; use drivers for context weighting.",
    "fallacy_groups": [
        {
            "group_id": "FG-STRWMN",
            "root": {
                "id": "F-STRAW",
                "label": "Strawman",
                "definition": "Misrepresenting an opponent’s position to make it easier to attack.",
                "principles": [
                    "Evidence",
                    "Representation"
                ],
                "drivers": [
                    "identity_protection",
                    "incentive_alignment"
                ],
                "severity": "high"
            },
            "variants": [
                {
                    "id": "F-STRAW-1",
                    "label": "Classic Strawman",
                    "aliases": [
                        "weak man",
                        "misrepresentation"
                    ],
                    "definition": "Substitute a distorted version of the claim, then refute that instead.",
                    "examples": [
                        "She says we should invest in QA; apparently she wants to waste money testing every tiny thing."
                    ],
                    "cues": {
                        "phrases": [
                            "so you're saying",
                            "what you really mean",
                            "basically they claim"
                        ],
                        "keywords": [
                            "exaggerate",
                            "distort",
                            "twist"
                        ],
                        "heuristics": [
                            "Claim paraphrase + intensifier words; mismatched modality vs original"
                        ]
                    },
                    "principles": [
                        "Evidence"
                    ],
                    "drivers": [
                        "identity_protection"
                    ],
                    "severity": "high"
                },
                {
                    "id": "F-STRAW-2",
                    "label": "Hollow Man",
                    "aliases": [
                        "fabricated opponent"
                    ],
                    "definition": "Invent a weak opposing view no one stated, then defeat it.",
                    "examples": [
                        "Some people think metrics are useless; clearly we shouldn’t track anything."
                    ],
                    "cues": {
                        "phrases": [
                            "some people say",
                            "everyone knows"
                        ],
                        "keywords": [
                            "nobody",
                            "everybody",
                            "always"
                        ],
                        "heuristics": [
                            "Unattributed plural + absolute quantifiers"
                        ]
                    },
                    "principles": [
                        "Representation"
                    ],
                    "drivers": [
                        "overload_complexity"
                    ],
                    "severity": "medium"
                }
            ]
        },
        {
            "group_id": "FG-ADHOM",
            "root": {
                "id": "F-ADHOM",
                "label": "Ad Hominem",
                "definition": "Attack the person rather than the argument.",
                "principles": [
                    "Respect",
                    "Evidence"
                ],
                "drivers": [
                    "status_games",
                    "identity_protection"
                ],
                "severity": "high"
            },
            "variants": [
                {
                    "id": "F-ADHOM-1",
                    "label": "Abusive Ad Hominem",
                    "aliases": [
                        "insult",
                        "name-calling"
                    ],
                    "definition": "Direct insult as a substitute for a reasoned response.",
                    "examples": [
                        "Your idea is dumb; next."
                    ],
                    "cues": {
                        "phrases": [],
                        "keywords": [
                            "idiot",
                            "clown",
                            "stupid"
                        ],
                        "heuristics": [
                            "Second-person attack + absence of claim engagement"
                        ]
                    },
                    "principles": [
                        "Respect"
                    ],
                    "drivers": [
                        "status_games"
                    ],
                    "severity": "high"
                },
                {
                    "id": "F-ADHOM-2",
                    "label": "Tu Quoque",
                    "aliases": [
                        "appeal to hypocrisy"
                    ],
                    "definition": "Dismiss a claim because the speaker is inconsistent.",
                    "examples": [
                        "You missed a deadline last month, so your scheduling plan is worthless."
                    ],
                    "cues": {
                        "phrases": [
                            "you also",
                            "you did the same"
                        ],
                        "keywords": [
                            "hypocrite",
                            "double standard"
                        ],
                        "heuristics": [
                            "Shift from claim merits → speaker behavior mismatch"
                        ]
                    },
                    "principles": [
                        "Evidence"
                    ],
                    "drivers": [
                        "identity_protection"
                    ],
                    "severity": "medium"
                }
            ]
        },
        {
            "group_id": "FG-POSTHOC",
            "root": {
                "id": "F-POSTHOC",
                "label": "Post Hoc",
                "definition": "Assuming causation because B followed A.",
                "principles": [
                    "Causality",
                    "Evidence"
                ],
                "drivers": [
                    "pattern_bias"
                ],
                "severity": "medium"
            },
            "variants": [
                {
                    "id": "F-POSTHOC-1",
                    "label": "Post hoc ergo propter hoc",
                    "aliases": [
                        "false cause"
                    ],
                    "definition": "Temporal order mistaken for causal link.",
                    "examples": [
                        "We launched the blog then sales rose; the blog caused the lift."
                    ],
                    "cues": {
                        "phrases": [
                            "after we",
                            "since then"
                        ],
                        "keywords": [
                            "caused",
                            "therefore"
                        ],
                        "heuristics": [
                            "Temporal connector + causal verb with no control comparison"
                        ]
                    },
                    "principles": [
                        "Causality"
                    ],
                    "drivers": [
                        "pattern_bias"
                    ],
                    "severity": "medium"
                }
            ]
        },
        {
            "group_id": "FG-FALSEDICHOT",
            "root": {
                "id": "F-FALSEDICH",
                "label": "False Dichotomy",
                "definition": "Presenting two options as the only possibilities.",
                "principles": [
                    "Scope",
                    "Alternatives"
                ],
                "drivers": [
                    "over_simplification",
                    "time_pressure"
                ],
                "severity": "high"
            },
            "variants": [
                {
                    "id": "F-FALSEDICH-1",
                    "label": "Either–Or",
                    "aliases": [
                        "black-and-white"
                    ],
                    "definition": "Forcing a binary choice when more options exist.",
                    "examples": [
                        "Either we pivot now or we die."
                    ],
                    "cues": {
                        "phrases": [
                            "either…or",
                            "if not X then Y"
                        ],
                        "keywords": [
                            "only",
                            "must",
                            "cannot"
                        ],
                        "heuristics": [
                            "Binary connective + absolute modal verbs"
                        ]
                    },
                    "principles": [
                        "Alternatives"
                    ],
                    "drivers": [
                        "time_pressure"
                    ],
                    "severity": "high"
                }
            ]
        },
        {
            "group_id": "FG-SLIPPERY",
            "root": {
                "id": "F-SLIPPERY",
                "label": "Slippery Slope",